{
  "$schema": "http://json-schema.org/draft-07/schema#",
  "$id": "https://redfire/contracts/switch_to_boss.wholesale_cdr.json",
  "title": "Switch -> BOSS: rated wholesale CDR",
  "description": "Output of redfire-switch's LCR/rating engine. One per completed call. Unlike ucaas_to_boss.usage_record, this call is ALREADY rated (LRN dip + jurisdiction + rate-deck lookup happened in the switch) -- B/OSS stores client_cost/vendor_cost as-is (rateSource=PASSTHROUGH) and never re-rates it via its own rating_plans. external_id is the idempotency key so retries are safe.",
  "type": "object",
  "additionalProperties": false,
  "required": ["external_id", "switch_customer_id", "call_id", "direction", "from", "to", "jurisdiction", "start_time", "end_time", "duration_seconds", "disposition", "client_rate", "client_billed_seconds", "client_cost", "currency_code", "usage_sequence"],
  "properties": {
    "external_id": { "type": "string", "minLength": 1, "description": "Idempotency key, call-UUID based" },
    "switch_customer_id": { "type": "string", "minLength": 1, "description": "Matches switch IpAuthConfig.customer_id == boss voice_accounts.switchAccountId -- NOT a boss accounts.id directly; boss resolves accountId via voice_accounts" },
    "call_id": { "type": "string", "minLength": 1 },
    "ingress_trunk_id": { "type": ["string", "null"] },
    "egress_trunk_id": { "type": ["string", "null"] },
    "direction": { "type": "string", "enum": ["origination", "termination"], "description": "origination = inbound from this customer to be routed out; termination = delivered to this customer" },
    "from": { "type": "string", "description": "ANI" },
    "to": { "type": "string", "description": "DNIS as dialed" },
    "lrn": { "type": ["string", "null"], "description": "Dipped Local Routing Number; null if no dip was performed (e.g. non-NANPA) or the dip failed" },
    "jurisdiction": { "type": "string", "enum": ["local", "intrastate", "interstate", "international", "indeterminate", "unknown"] },
    "start_time": { "type": "string", "format": "date-time" },
    "answer_time": { "type": ["string", "null"], "format": "date-time" },
    "end_time": { "type": "string", "format": "date-time" },
    "duration_seconds": { "type": "integer", "minimum": 0, "description": "Raw/unrounded call duration" },
    "disposition": { "type": "string", "enum": ["answered", "no_answer", "busy", "failed", "canceled"] },
    "client_rate": { "type": "number", "minimum": 0, "description": "Sell-side per-unit rate charged to the boss account" },
    "client_billed_seconds": { "type": "integer", "minimum": 0, "description": "Sell-side billed duration after the switch's own initial/increment rounding" },
    "client_cost": { "type": "number", "minimum": 0, "description": "Final sell-side dollar amount; boss stores this verbatim as originalCost/ratedCost" },
    "client_rate_deck_version": { "type": ["string", "null"], "description": "Audit trail: which client_rate_decks version priced this call" },
    "vendor_rate": { "type": ["number", "null"], "minimum": 0, "description": "Buy-side per-unit rate; null if no vendor/cost-side deck matched (informational only, never blocks client billing)" },
    "vendor_billed_seconds": { "type": ["integer", "null"], "minimum": 0 },
    "vendor_cost": { "type": ["number", "null"], "minimum": 0 },
    "vendor_rate_deck_version": { "type": ["string", "null"] },
    "currency_code": { "type": "string", "pattern": "^[A-Z]{3}$" },
    "usage_sequence": { "type": "integer", "minimum": 0, "description": "Per-customer monotonic; gaps signal loss" }
  }
}
