{
  "external_id": "swcall_7f3a-1",
  "switch_customer_id": "cust_carrierone_042",
  "call_id": "7f3a",
  "ingress_trunk_id": "trunk-ingress-17",
  "egress_trunk_id": "trunk-egress-03",
  "direction": "termination",
  "from": "+15551234567",
  "to": "+14155550100",
  "lrn": "4155550000",
  "jurisdiction": "interstate",
  "start_time": "2026-01-15T10:00:00Z",
  "answer_time": "2026-01-15T10:00:04Z",
  "end_time": "2026-01-15T10:03:04Z",
  "duration_seconds": 180,
  "disposition": "answered",
  "client_rate": 0.012,
  "client_billed_seconds": 180,
  "client_cost": 0.036,
  "client_rate_deck_version": "client-deck-v14",
  "vendor_rate": 0.008,
  "vendor_billed_seconds": 180,
  "vendor_cost": 0.024,
  "vendor_rate_deck_version": "vendor-deck-v9",
  "currency_code": "USD",
  "usage_sequence": 101
}
